{
  "$schema": "http://json-schema.org/draft-07/schema#",
  "type": "object",
  "properties": {
    "name": {
      "type": "string"
    },
    "dateOfBirth": {
      "type": "string"
    },
    "contact": {
      "type": "object",
      "properties": {
        "email": {
          "type": "string",
          "format": "email"
        },
        "phone": {
          "type": "string"
        },
        "linkedin": {
          "type": "string"
        },
        "website": {
          "type": "string"
        },
        "location": {
          "type": "string"
        }
      },
      "required": [
        "email",
        "phone",
        "location"
      ]
    },
    "skills": {
      "type": "array",
      "items": {
        "type": "string"
      }
    },
    "personalQualities": {
      "type": "array",
      "items": {
        "type": "string"
      }
    },
    "education": {
      "type": "array",
      "items": {
        "type": "object",
        "properties": {
          "title": {
            "type": "string"
          },
          "dateFrom": {
            "type": "string"
          },
          "dateTo": {
            "type": "string"
          },
          "qualificationLevels": {
            "type": "array",
            "items": {
              "type": "object",
              "properties": {
                "type": {
                  "type": "string"
                },
                "qualifications": {
                  "type": "array",
                  "items": {
                    "type": "object",
                    "properties": {
                      "name": {
                        "type": "string"
                      },
                      "grade": {
                        "type": "string"
                      }
                    },
                    "required": [
                      "name"
                    ]
                  }
                }
              },
              "required": [
                "type",
                "qualifications"
              ]
            }
          }
        },
        "required": [
          "title",
          "dateFrom",
          "dateTo"
        ]
      }
    },
    "volunteerExperience": {
      "type": "array",
      "items": {
        "type": "object",
        "properties": {
          "title": {
            "type": "string"
          },
          "dateFrom": {
            "type": "string"
          },
          "dateTo": {
            "type": "string"
          },
          "statement": {
            "type": "string"
          }
        },
        "required": [
          "title",
          "dateFrom",
          "dateTo",
          "statement"
        ]
      }
    },
    "jobHistory": {
      "type": "array",
      "items": {
        "type": "object",
        "properties": {
          "title": {
            "type": "string"
          },
          "stages": {
            "type": "array",
            "items": {
              "type": "object",
              "properties": {
                "jobTitle": {
                  "type": "string"
                },
                "dateFrom": {
                  "type": "string"
                },
                "dateTo": {
                  "type": "string"
                }
              },
              "required": [
                "jobTitle",
                "dateFrom",
                "dateTo"
              ]
            }
          },
          "statement": {
            "type": "string"
          },
          "highlights": {
            "type": "array",
            "items": {
              "type": "string"
            }
          }
        },
        "required": [
          "title",
          "stages",
          "statement",
          "highlights"
        ]
      }
    }
  },
  "required": [
    "name",
    "contact",
    "skills",
    "education",
    "jobHistory"
  ]
}